film_id,title,description,release_year,language_id,rental_duration,rental_rate,length,replacement_cost,rating,special_features,last_update
1,ACADEMY DINOSAUR,A Epic Drama of a Feminist And a Mad Scientist who must Battle a Teacher in The Canadian Rockies,2006,1,6,0.99,86,20.99,PG,"Deleted Scenes,Behind the Scenes",2023-07-30 11:48:33
2,ACE GOLDFINGER,A Astounding Epistle of a Database Administrator And a Explorer who must Find a Car in Ancient China,2006,1,3,4.99,48,12.99,G,"Trailers,Deleted Scenes",2023-07-30 11:48:33
3,ADAPTATION HOLES,A Astounding Reflection of a Lumberjack And a Car who must Sink a Lumberjack in A Baloon Factory,2006,1,7,2.99,50,18.99,NC-17,"Trailers,Deleted Scenes",2023-07-30 11:48:33
4,AFFAIR PREJUDICE,A Fanciful Documentary of a Frisbee And a Lumberjack who must Chase a Monkey in A Shark Tank,2006,1,5,2.99,117,26.99,G,"Commentaries,Behind the Scenes",2023-07-30 11:48:33
5,AFRICAN EGG,A Fast-Paced Documentary of a Pastry Chef And a Dentist who must Pursue a Forensic Psychologist in The Gulf of Mexico,2006,1,6,2.99,130,22.99,G,Deleted Scenes,2023-07-30 11:48:33
6,AGENT TRUMAN,A Intrepid Panorama of a Robot And a Boy who must Escape a Sumo Wrestler in Ancient China,2006,1,3,2.99,169,17.99,PG,Deleted Scenes,2023-07-30 11:48:33
7,AIRPLANE SIERRA,A Touching Saga of a Hunter And a Butler who must Discover a Butler in A Jet Boat,2006,1,6,4.99,62,28.99,PG-13,"Trailers,Deleted Scenes",2023-07-30 11:48:33
8,AIRPORT POLLOCK,A Epic Tale of a Moose And a Girl who must Confront a Monkey in Ancient India,2006,1,6,4.99,54,15.99,R,Trailers,2023-07-30 11:48:33
9,ALABAMA DEVIL,A Thoughtful Panorama of a Database Administrator And a Mad Scientist who must Outgun a Mad Scientist in A Jet Boat,2006,1,3,2.99,114,21.99,PG-13,"Trailers,Deleted Scenes",2023-07-30 11:48:33
10,ALADDIN CALENDAR,A Action-Packed Tale of a Man And a Lumberjack who must Reach a Feminist in Ancient China,2006,1,6,4.99,63,24.99,NC-17,"Trailers,Deleted Scenes",2023-07-30 11:48:33
11,ALAMO VIDEOTAPE,A Boring Epistle of a Butler And a Cat who must Fight a Pastry Chef in A MySQL Convention,2006,1,6,0.99,126,16.99,G,"Commentaries,Behind the Scenes",2023-07-30 11:48:33
12,ALASKA PHANTOM,A Fanciful Saga of a Hunter And a Pastry Chef who must Vanquish a Boy in Australia,2006,1,6,0.99,136,22.99,PG,"Commentaries,Deleted Scenes",2023-07-30 11:48:33
13,ALI FOREVER,A Action-Packed Drama of a Dentist And a Crocodile who must Battle a Feminist in The Canadian Rockies,2006,1,4,4.99,150,21.99,PG,"Deleted Scenes,Behind the Scenes",2023-07-30 11:48:33
15,ALIEN CENTER,A Brilliant Drama of a Cat And a Mad Scientist who must Battle a Feminist in A MySQL Convention,2006,1,5,2.99,46,10.99,NC-17,"Trailers,Commentaries,Behind the Scenes",2023-07-30 11:48:33
16,ALLEY EVOLUTION,A Fast-Paced Drama of a Robot And a Composer who must Battle a Astronaut in New Orleans,2006,1,6,2.99,180,23.99,NC-17,"Trailers,Commentaries",2023-07-30 11:48:33
17,ALONE TRIP,A Fast-Paced Character Study of a Composer And a Dog who must Outgun a Boat in An Abandoned Fun House,2006,1,3,0.99,82,14.99,R,"Trailers,Behind the Scenes",2023-07-30 11:48:33
18,ALTER VICTORY,A Thoughtful Drama of a Composer And a Feminist who must Meet a Secret Agent in The Canadian Rockies,2006,1,6,0.99,57,27.99,PG-13,"Trailers,Behind the Scenes",2023-07-30 11:48:33
19,AMADEUS HOLY,A Emotional Display of a Pioneer And a Technical Writer who must Battle a Man in A Baloon,2006,1,6,0.99,113,20.99,PG,"Commentaries,Deleted Scenes,Behind the Scenes",2023-07-30 11:48:33
20,AMELIE HELLFIGHTERS,A Boring Drama of a Woman And a Squirrel who must Conquer a Student in A Baloon,2006,1,4,4.99,79,23.99,R,"Commentaries,Deleted Scenes,Behind the Scenes",2023-07-30 11:48:33
21,AMERICAN CIRCUS,A Insightful Drama of a Girl And a Astronaut who must Face a Database Administrator in A Shark Tank,2006,1,3,4.99,129,17.99,R,"Commentaries,Behind the Scenes",2023-07-30 11:48:33
22,AMISTAD MIDSUMMER,A Emotional Character Study of a Dentist And a Crocodile who must Meet a Sumo Wrestler in California,2006,1,6,2.99,85,10.99,G,"Commentaries,Behind the Scenes",2023-07-30 11:48:33
23,ANACONDA CONFESSIONS,A Lacklusture Display of a Dentist And a Dentist who must Fight a Girl in Australia,2006,1,3,0.99,92,9.99,R,"Trailers,Deleted Scenes",2023-07-30 11:48:33
24,ANALYZE HOOSIERS,A Thoughtful Display of a Explorer And a Pastry Chef who must Overcome a Feminist in The Sahara Desert,2006,1,6,2.99,181,19.99,R,"Trailers,Behind the Scenes",2023-07-30 11:48:33
25,ANGELS LIFE,A Thoughtful Display of a Woman And a Astronaut who must Battle a Robot in Berlin,2006,1,3,2.99,74,15.99,G,Trailers,2023-07-30 11:48:33
26,ANNIE IDENTITY,A Amazing Panorama of a Pastry Chef And a Boat who must Escape a Woman in An Abandoned Amusement Park,2006,1,3,0.99,86,15.99,G,"Commentaries,Deleted Scenes",2023-07-30 11:48:33
27,ANONYMOUS HUMAN,A Amazing Reflection of a Database Administrator And a Astronaut who must Outrace a Database Administrator in A Shark Tank,2006,1,7,0.99,179,12.99,NC-17,"Deleted Scenes,Behind the Scenes",2023-07-30 11:48:33
28,ANTHEM LUKE,A Touching Panorama of a Waitress And a Woman who must Outrace a Dog in An Abandoned Amusement Park,2006,1,5,4.99,91,16.99,PG-13,"Deleted Scenes,Behind the Scenes",2023-07-30 11:48:33
29,ANTITRUST TOMATOES,A Fateful Yarn of a Womanizer And a Feminist who must Succumb a Database Administrator in Ancient India,2006,1,5,2.99,168,11.99,NC-17,"Trailers,Commentaries,Deleted Scenes",2023-07-30 11:48:33
30,ANYTHING SAVANNAH,A Epic Story of a Pastry Chef And a Woman who must Chase a Feminist in An Abandoned Fun House,2006,1,4,2.99,82,27.99,R,"Trailers,Deleted Scenes,Behind the Scenes",2023-07-30 11:48:33
31,APACHE DIVINE,A Awe-Inspiring Reflection of a Pastry Chef And a Teacher who must Overcome a Sumo Wrestler in A U-Boat,2006,1,5,4.99,92,16.99,NC-17,"Commentaries,Deleted Scenes,Behind the Scenes",2023-07-30 11:48:33
32,APOCALYPSE FLAMINGOS,A Astounding Story of a Dog And a Squirrel who must Defeat a Woman in An Abandoned Amusement Park,2006,1,6,4.99,119,11.99,R,"Trailers,Commentaries",2023-07-30 11:48:33
34,ARABIA DOGMA,A Touching Epistle of a Madman And a Mad Cow who must Defeat a Student in Nigeria,2006,1,6,0.99,62,29.99,NC-17,"Commentaries,Deleted Scenes",2023-07-30 11:48:33
35,ARACHNOPHOBIA ROLLERCOASTER,A Action-Packed Reflection of a Pastry Chef And a Composer who must Discover a Mad Scientist in The First Manned Space Station,2006,1,4,2.99,147,24.99,PG-13,"Trailers,Deleted Scenes,Behind the Scenes",2023-07-30 11:48:33
37,ARIZONA BANG,A Brilliant Panorama of a Mad Scientist And a Mad Cow who must Meet a Pioneer in A Monastery,2006,1,3,2.99,121,28.99,PG,"Trailers,Deleted Scenes",2023-07-30 11:48:33
39,ARMAGEDDON LOST,A Fast-Paced Tale of a Boat And a Teacher who must Succumb a Composer in An Abandoned Mine Shaft,2006,1,5,0.99,99,10.99,G,Trailers,2023-07-30 11:48:33
40,ARMY FLINTSTONES,A Boring Saga of a Database Administrator And a Womanizer who must Battle a Waitress in Nigeria,2006,1,4,0.99,148,22.99,R,"Trailers,Commentaries",2023-07-30 11:48:33
42,ARTIST COLDBLOODED,A Stunning Reflection of a Robot And a Moose who must Challenge a Woman in California,2006,1,5,2.99,170,10.99,NC-17,"Trailers,Behind the Scenes",2023-07-30 11:48:33
43,ATLANTIS CAUSE,A Thrilling Yarn of a Feminist And a Hunter who must Fight a Technical Writer in A Shark Tank,2006,1,6,2.99,170,15.99,G,Behind the Scenes,2023-07-30 11:48:33
44,ATTACKS HATE,A Fast-Paced Panorama of a Technical Writer And a Mad Scientist who must Find a Feminist in An Abandoned Mine Shaft,2006,1,5,4.99,113,21.99,PG-13,"Trailers,Behind the Scenes",2023-07-30 11:48:33
45,ATTRACTION NEWTON,A Astounding Panorama of a Composer And a Frisbee who must Reach a Husband in Ancient Japan,2006,1,5,4.99,83,14.99,PG-13,"Trailers,Behind the Scenes",2023-07-30 11:48:33
46,AUTUMN CROW,A Beautiful Tale of a Dentist And a Mad Cow who must Battle a Moose in The Sahara Desert,2006,1,3,4.99,108,13.99,G,"Trailers,Commentaries,Deleted Scenes,Behind the Scenes",2023-07-30 11:48:33
47,BABY HALL,A Boring Character Study of a A Shark And a Girl who must Outrace a Feminist in An Abandoned Mine Shaft,2006,1,5,4.99,153,23.99,NC-17,Commentaries,2023-07-30 11:48:33
48,BACKLASH UNDEFEATED,A Stunning Character Study of a Mad Scientist And a Mad Cow who must Kill a Car in A Monastery,2006,1,3,4.99,118,24.99,PG-13,"Trailers,Behind the Scenes",2023-07-30 11:48:33
49,BADMAN DAWN,A Emotional Panorama of a Pioneer And a Composer who must Escape a Mad Scientist in A Jet Boat,2006,1,6,2.99,162,22.99,R,"Trailers,Commentaries,Behind the Scenes",2023-07-30 11:48:33
50,BAKED CLEOPATRA,A Stunning Drama of a Forensic Psychologist And a Husband who must Overcome a Waitress in A Monastery,2006,1,3,2.99,182,20.99,G,"Commentaries,Behind the Scenes",2023-07-30 11:48:33
51,BALLOON HOMEWARD,A Insightful Panorama of a Forensic Psychologist And a Mad Cow who must Build a Mad Scientist in The First Manned Space Station,2006,1,5,2.99,75,10.99,NC-17,Deleted Scenes,2023-07-30 11:48:33
52,BALLROOM MOCKINGBIRD,A Thrilling Documentary of a Composer And a Monkey who must Find a Feminist in California,2006,1,6,0.99,173,29.99,G,"Commentaries,Deleted Scenes",2023-07-30 11:48:33
53,BANG KWAI,A Epic Drama of a Madman And a Cat who must Face a A Shark in An Abandoned Amusement Park,2006,1,5,2.99,87,25.99,NC-17,"Commentaries,Deleted Scenes,Behind the Scenes",2023-07-30 11:48:33
54,BANGER PINOCCHIO,A Awe-Inspiring Drama of a Car And a Pastry Chef who must Chase a Crocodile in The First Manned Space Station,2006,1,5,0.99,113,15.99,R,"Trailers,Commentaries,Deleted Scenes",2023-07-30 11:48:33
55,BARBARELLA STREETCAR,A Awe-Inspiring Story of a Feminist And a Cat who must Conquer a Dog in A Monastery,2006,1,6,2.99,65,27.99,G,Behind the Scenes,2023-07-30 11:48:33
56,BAREFOOT MANCHURIAN,A Intrepid Story of a Cat And a Student who must Vanquish a Girl in An Abandoned Amusement Park,2006,1,6,2.99,129,15.99,G,"Trailers,Commentaries",2023-07-30 11:48:33
57,BASIC EASY,A Stunning Epistle of a Man And a Husband who must Reach a Mad Scientist in A Jet Boat,2006,1,4,2.99,90,18.99,PG-13,Deleted Scenes,2023-07-30 11:48:33
58,BEACH HEARTBREAKERS,A Fateful Display of a Womanizer And a Mad Scientist who must Outgun a A Shark in Soviet Georgia,2006,1,6,2.99,122,16.99,G,"Deleted Scenes,Behind the Scenes",2023-07-30 11:48:33
59,BEAR GRACELAND,A Astounding Saga of a Dog And a Boy who must Kill a Teacher in The First Manned Space Station,2006,1,4,2.99,160,20.99,R,Deleted Scenes,2023-07-30 11:48:33
60,BEAST HUNCHBACK,A Awe-Inspiring Epistle of a Student And a Squirrel who must Defeat a Boy in Ancient China,2006,1,3,4.99,89,22.99,R,"Deleted Scenes,Behind the Scenes",2023-07-30 11:48:33
61,BEAUTY GREASE,A Fast-Paced Display of a Composer And a Moose who must Sink a Robot in An Abandoned Mine Shaft,2006,1,5,4.99,175,28.99,G,"Trailers,Commentaries",2023-07-30 11:48:33
62,BED HIGHBALL,A Astounding Panorama of a Lumberjack And a Dog who must Redeem a Woman in An Abandoned Fun House,2006,1,5,2.99,106,23.99,NC-17,"Trailers,Commentaries,Deleted Scenes",2023-07-30 11:48:33
63,BEDAZZLED MARRIED,A Astounding Character Study of a Madman And a Robot who must Meet a Mad Scientist in An Abandoned Fun House,2006,1,6,0.99,73,21.99,PG,"Trailers,Deleted Scenes,Behind the Scenes",2023-07-30 11:48:33
64,BEETHOVEN EXORCIST,A Epic Display of a Pioneer And a Student who must Challenge a Butler in The Gulf of Mexico,2006,1,6,0.99,151,26.99,PG-13,"Commentaries,Behind the Scenes",2023-07-30 11:48:33
65,BEHAVIOR RUNAWAY,A Unbelieveable Drama of a Student And a Husband who must Outrace a Sumo Wrestler in Berlin,2006,1,3,4.99,100,20.99,PG,"Trailers,Deleted Scenes,Behind the Scenes",2023-07-30 11:48:33
66,BENEATH RUSH,A Astounding Panorama of a Man And a Monkey who must Discover a Man in The First Manned Space Station,2006,1,6,0.99,53,27.99,NC-17,"Commentaries,Deleted Scenes",2023-07-30 11:48:33
67,BERETS AGENT,A Taut Saga of a Crocodile And a Boy who must Overcome a Technical Writer in Ancient China,2006,1,5,2.99,77,24.99,PG-13,Deleted Scenes,2023-07-30 11:48:33
68,BETRAYED REAR,A Emotional Character Study of a Boat And a Pioneer who must Find a Explorer in A Shark Tank,2006,1,5,4.99,122,26.99,NC-17,"Commentaries,Deleted Scenes,Behind the Scenes",2023-07-30 11:48:33
69,BEVERLY OUTLAW,A Fanciful Documentary of a Womanizer And a Boat who must Defeat a Madman in The First Manned Space Station,2006,1,3,2.99,85,21.99,R,Trailers,2023-07-30 11:48:33
70,BIKINI BORROWERS,A Astounding Drama of a Astronaut And a Cat who must Discover a Woman in The First Manned Space Station,2006,1,7,4.99,142,26.99,NC-17,"Commentaries,Deleted Scenes",2023-07-30 11:48:33
71,BILKO ANONYMOUS,A Emotional Reflection of a Teacher And a Man who must Meet a Cat in The First Manned Space Station,2006,1,3,4.99,100,25.99,PG-13,"Commentaries,Deleted Scenes,Behind the Scenes",2023-07-30 11:48:33
72,BILL OTHERS,A Stunning Saga of a Mad Scientist And a Forensic Psychologist who must Challenge a Squirrel in A MySQL Convention,2006,1,6,2.99,93,12.99,PG,"Trailers,Commentaries",2023-07-30 11:48:33
73,BINGO TALENTED,A Touching Tale of a Girl And a Crocodile who must Discover a Waitress in Nigeria,2006,1,5,2.99,150,22.99,PG-13,"Trailers,Commentaries",2023-07-30 11:48:33
74,BIRCH ANTITRUST,A Fanciful Panorama of a Husband And a Pioneer who must Outgun a Dog in A Baloon,2006,1,4,4.99,162,18.99,PG,"Trailers,Commentaries,Deleted Scenes",2023-07-30 11:48:33
75,BIRD INDEPENDENCE,A Thrilling Documentary of a Car And a Student who must Sink a Hunter in The Canadian Rockies,2006,1,6,4.99,163,14.99,G,"Commentaries,Behind the Scenes",2023-07-30 11:48:33
76,BIRDCAGE CASPER,A Fast-Paced Saga of a Frisbee And a Astronaut who must Overcome a Feminist in Ancient India,2006,1,4,0.99,103,23.99,NC-17,"Commentaries,Deleted Scenes,Behind the Scenes",2023-07-30 11:48:33
77,BIRDS PERDITION,A Boring Story of a Womanizer And a Pioneer who must Face a Dog in California,2006,1,5,4.99,61,15.99,G,"Trailers,Behind the Scenes",2023-07-30 11:48:33
78,BLACKOUT PRIVATE,A Intrepid Yarn of a Pastry Chef And a Mad Scientist who must Challenge a Secret Agent in Ancient Japan,2006,1,7,2.99,85,12.99,PG,"Trailers,Deleted Scenes",2023-07-30 11:48:33
79,BLADE POLISH,A Thoughtful Character Study of a Frisbee And a Pastry Chef who must Fight a Dentist in The First Manned Space Station,2006,1,5,0.99,114,10.99,PG-13,"Trailers,Behind the Scenes",2023-07-30 11:48:33
80,BLANKET BEVERLY,A Emotional Documentary of a Student And a Girl who must Build a Boat in Nigeria,2006,1,7,2.99,148,21.99,G,Trailers,2023-07-30 11:48:33
81,BLINDNESS GUN,A Touching Drama of a Robot And a Dentist who must Meet a Hunter in A Jet Boat,2006,1,6,4.99,103,29.99,PG-13,"Trailers,Behind the Scenes",2023-07-30 11:48:33
82,BLOOD ARGONAUTS,A Boring Drama of a Explorer And a Man who must Kill a Lumberjack in A Manhattan Penthouse,2006,1,3,0.99,71,13.99,G,"Trailers,Commentaries,Behind the Scenes",2023-07-30 11:48:33
83,BLUES INSTINCT,A Insightful Documentary of a Boat And a Composer who must Meet a Forensic Psychologist in An Abandoned Fun House,2006,1,5,2.99,50,18.99,G,"Trailers,Deleted Scenes,Behind the Scenes",2023-07-30 11:48:33
84,BOILED DARES,A Awe-Inspiring Story of a Waitress And a Dog who must Discover a Dentist in Ancient Japan,2006,1,7,4.99,102,13.99,PG,"Trailers,Commentaries",2023-07-30 11:48:33
85,BONNIE HOLOCAUST,A Fast-Paced Story of a Crocodile And a Robot who must Find a Moose in Ancient Japan,2006,1,4,0.99,63,29.99,G,Deleted Scenes,2023-07-30 11:48:33
86,BOOGIE AMELIE,A Lacklusture Character Study of a Husband And a Sumo Wrestler who must Succumb a Technical Writer in The Gulf of Mexico,2006,1,6,4.99,121,11.99,R,"Commentaries,Behind the Scenes",2023-07-30 11:48:33
88,BORN SPINAL,A Touching Epistle of a Frisbee And a Husband who must Pursue a Student in Nigeria,2006,1,7,4.99,179,17.99,PG,"Trailers,Commentaries,Deleted Scenes",2023-07-30 11:48:33
89,BORROWERS BEDAZZLED,A Brilliant Epistle of a Teacher And a Sumo Wrestler who must Defeat a Man in An Abandoned Fun House,2006,1,7,0.99,63,22.99,G,"Commentaries,Deleted Scenes,Behind the Scenes",2023-07-30 11:48:33
90,BOULEVARD MOB,A Fateful Epistle of a Moose And a Monkey who must Confront a Lumberjack in Ancient China,2006,1,3,0.99,63,11.99,R,Trailers,2023-07-30 11:48:33
91,BOUND CHEAPER,A Thrilling Panorama of a Database Administrator And a Astronaut who must Challenge a Lumberjack in A Baloon,2006,1,5,0.99,98,17.99,PG,Behind the Scenes,2023-07-30 11:48:33
92,BOWFINGER GABLES,A Fast-Paced Yarn of a Waitress And a Composer who must Outgun a Dentist in California,2006,1,7,4.99,72,19.99,NC-17,"Trailers,Deleted Scenes",2023-07-30 11:48:33
93,BRANNIGAN SUNRISE,A Amazing Epistle of a Moose And a Crocodile who must Outrace a Dog in Berlin,2006,1,4,4.99,121,27.99,PG,Trailers,2023-07-30 11:48:33
94,BRAVEHEART HUMAN,A Insightful Story of a Dog And a Pastry Chef who must Battle a Girl in Berlin,2006,1,7,2.99,176,14.99,PG-13,"Trailers,Deleted Scenes",2023-07-30 11:48:33
95,BREAKFAST GOLDFINGER,A Beautiful Reflection of a Student And a Student who must Fight a Moose in Berlin,2006,1,5,4.99,123,18.99,G,"Trailers,Commentaries,Deleted Scenes",2023-07-30 11:48:33
96,BREAKING HOME,A Beautiful Display of a Secret Agent And a Monkey who must Battle a Sumo Wrestler in An Abandoned Mine Shaft,2006,1,4,2.99,169,21.99,PG-13,"Trailers,Commentaries",2023-07-30 11:48:33
97,BRIDE INTRIGUE,A Epic Tale of a Robot And a Monkey who must Vanquish a Man in New Orleans,2006,1,7,0.99,56,24.99,G,"Trailers,Commentaries,Behind the Scenes",2023-07-30 11:48:33
98,BRIGHT ENCOUNTERS,A Fateful Yarn of a Lumberjack And a Feminist who must Conquer a Student in A Jet Boat,2006,1,4,4.99,73,12.99,PG-13,Trailers,2023-07-30 11:48:33
99,BRINGING HYSTERICAL,A Fateful Saga of a A Shark And a Technical Writer who must Find a Woman in A Jet Boat,2006,1,7,2.99,136,14.99,PG,Trailers,2023-07-30 11:48:33
100,BROOKLYN DESERT,A Beautiful Drama of a Dentist And a Composer who must Battle a Sumo Wrestler in The First Manned Space Station,2006,1,7,4.99,161,21.99,R,Commentaries,2023-07-30 11:48:33
101,BROTHERHOOD BLANKET,A Fateful Character Study of a Butler And a Technical Writer who must Sink a Astronaut in Ancient Japan,2006,1,3,0.99,73,26.99,R,Behind the Scenes,2023-07-30 11:48:33
102,BUBBLE GROSSE,A Awe-Inspiring Panorama of a Crocodile And a Moose who must Confront a Girl in A Baloon,2006,1,4,4.99,60,20.99,R,"Trailers,Commentaries,Deleted Scenes,Behind the Scenes",2023-07-30 11:48:33
103,BUCKET BROTHERHOOD,A Amazing Display of a Girl And a Womanizer who must Succumb a Lumberjack in A Baloon Factory,2006,1,7,4.99,133,27.99,PG,"Commentaries,Deleted Scenes",2023-07-30 11:48:33
104,BUGSY SONG,A Awe-Inspiring Character Study of a Secret Agent And a Boat who must Find a Squirrel in The First Manned Space Station,2006,1,4,2.99,119,17.99,G,Commentaries,2023-07-30 11:48:33
105,BULL SHAWSHANK,A Fanciful Drama of a Moose And a Squirrel who must Conquer a Pioneer in The Canadian Rockies,2006,1,6,0.99,125,21.99,NC-17,Deleted Scenes,2023-07-30 11:48:33
106,BULWORTH COMMANDMENTS,A Amazing Display of a Mad Cow And a Pioneer who must Redeem a Sumo Wrestler in The Outback,2006,1,4,2.99,61,14.99,G,Trailers,2023-07-30 11:48:33
107,BUNCH MINDS,A Emotional Story of a Feminist And a Feminist who must Escape a Pastry Chef in A MySQL Convention,2006,1,4,2.99,63,13.99,G,Behind the Scenes,2023-07-30 11:48:33
109,BUTTERFLY CHOCOLAT,A Fateful Story of a Girl And a Composer who must Conquer a Husband in A Shark Tank,2006,1,3,0.99,89,17.99,G,Behind the Scenes,2023-07-30 11:48:33
110,CABIN FLASH,A Stunning Epistle of a Boat And a Man who must Challenge a A Shark in A Baloon Factory,2006,1,4,0.99,53,25.99,NC-17,"Commentaries,Deleted Scenes",2023-07-30 11:48:33
111,CADDYSHACK JEDI,A Awe-Inspiring Epistle of a Woman And a Madman who must Fight a Robot in Soviet Georgia,2006,1,3,0.99,52,17.99,NC-17,"Commentaries,Deleted Scenes",2023-07-30 11:48:33
112,CALENDAR GUNFIGHT,A Thrilling Drama of a Frisbee And a Lumberjack who must Sink a Man in Nigeria,2006,1,4,4.99,120,22.99,NC-17,"Trailers,Commentaries,Behind the Scenes",2023-07-30 11:48:33
113,CALIFORNIA BIRDS,A Thrilling Yarn of a Database Administrator And a Robot who must Battle a Database Administrator in Ancient India,2006,1,4,4.99,75,19.99,NC-17,"Trailers,Commentaries,Deleted Scenes",2023-07-30 11:48:33
114,CAMELOT VACATION,A Touching Character Study of a Woman And a Waitress who must Battle a Pastry Chef in A MySQL Convention,2006,1,3,0.99,61,26.99,NC-17,"Trailers,Commentaries,Deleted Scenes,Behind the Scenes",2023-07-30 11:48:33
115,CAMPUS REMEMBER,A Astounding Drama of a Crocodile And a Mad Cow who must Build a Robot in A Jet Boat,2006,1,5,2.99,167,27.99,R,Behind the Scenes,2023-07-30 11:48:33
116,CANDIDATE PERDITION,A Brilliant Epistle of a Composer And a Database Administrator who must Vanquish a Mad Scientist in The First Manned Space Station,2006,1,4,2.99,70,10.99,R,"Deleted Scenes,Behind the Scenes",2023-07-30 11:48:33
117,CANDLES GRAPES,A Fanciful Character Study of a Monkey And a Explorer who must Build a Astronaut in An Abandoned Fun House,2006,1,6,4.99,135,15.99,NC-17,"Trailers,Deleted Scenes",2023-07-30 11:48:33
118,CANYON STOCK,A Thoughtful Reflection of a Waitress And a Feminist who must Escape a Squirrel in A Manhattan Penthouse,2006,1,7,0.99,85,26.99,R,"Trailers,Deleted Scenes",2023-07-30 11:48:33
119,CAPER MOTIONS,A Fateful Saga of a Moose And a Car who must Pursue a Woman in A MySQL Convention,2006,1,6,0.99,176,22.99,G,"Trailers,Commentaries,Deleted Scenes",2023-07-30 11:48:33
120,CARIBBEAN LIBERTY,A Fanciful Tale of a Pioneer And a Technical Writer who must Outgun a Pioneer in A Shark Tank,2006,1,3,4.99,92,16.99,NC-17,"Commentaries,Deleted Scenes",2023-07-30 11:48:33
121,CAROL TEXAS,A Astounding Character Study of a Composer And a Student who must Overcome a Composer in A Monastery,2006,1,4,2.99,151,15.99,PG,"Trailers,Behind the Scenes",2023-07-30 11:48:33
122,CARRIE BUNCH,A Amazing Epistle of a Student And a Astronaut who must Discover a Frisbee in The Canadian Rockies,2006,1,7,0.99,114,11.99,PG,"Trailers,Commentaries,Behind the Scenes",2023-07-30 11:48:33
123,CASABLANCA SUPER,A Amazing Panorama of a Crocodile And a Forensic Psychologist who must Pursue a Secret Agent in The First Manned Space Station,2006,1,6,4.99,85,22.99,G,"Trailers,Deleted Scenes,Behind the Scenes",2023-07-30 11:48:33
124,CASPER DRAGONFLY,A Intrepid Documentary of a Boat And a Crocodile who must Chase a Robot in The Sahara Desert,2006,1,3,4.99,163,16.99,PG-13,Trailers,2023-07-30 11:48:33
125,CASSIDY WYOMING,A Intrepid Drama of a Frisbee And a Hunter who must Kill a Secret Agent in New Orleans,2006,1,5,2.99,61,19.99,NC-17,"Commentaries,Behind the Scenes",2023-07-30 11:48:33
126,CASUALTIES ENCINO,A Insightful Yarn of a A Shark And a Pastry Chef who must Face a Boy in A Monastery,2006,1,3,4.99,179,16.99,G,Trailers,2023-07-30 11:48:33
127,CAT CONEHEADS,A Fast-Paced Panorama of a Girl And a A Shark who must Confront a Boy in Ancient India,2006,1,5,4.99,112,14.99,G,"Commentaries,Deleted Scenes",2023-07-30 11:48:33
129,CAUSE DATE,A Taut Tale of a Explorer And a Pastry Chef who must Conquer a Hunter in A MySQL Convention,2006,1,3,2.99,179,16.99,R,"Commentaries,Deleted Scenes,Behind the Scenes",2023-07-30 11:48:33
130,CELEBRITY HORN,A Amazing Documentary of a Secret Agent And a Astronaut who must Vanquish a Hunter in A Shark Tank,2006,1,7,0.99,110,24.99,PG-13,"Deleted Scenes,Behind the Scenes",2023-07-30 11:48:33
131,CENTER DINOSAUR,A Beautiful Character Study of a Sumo Wrestler And a Dentist who must Find a Dog in California,2006,1,5,4.99,152,12.99,PG,Deleted Scenes,2023-07-30 11:48:33
132,CHAINSAW UPTOWN,A Beautiful Documentary of a Boy And a Robot who must Discover a Squirrel in Australia,2006,1,6,0.99,114,25.99,PG,"Deleted Scenes,Behind the Scenes",2023-07-30 11:48:33
133,CHAMBER ITALIAN,A Fateful Reflection of a Moose And a Husband who must Overcome a Monkey in Nigeria,2006,1,7,4.99,117,14.99,NC-17,Trailers,2023-07-30 11:48:33
134,CHAMPION FLATLINERS,A Amazing Story of a Mad Cow And a Dog who must Kill a Husband in A Monastery,2006,1,4,4.99,51,21.99,PG,Trailers,2023-07-30 11:48:33
135,CHANCE RESURRECTION,A Astounding Story of a Forensic Psychologist And a Forensic Psychologist who must Overcome a Moose in Ancient China,2006,1,3,2.99,70,22.99,R,"Commentaries,Deleted Scenes,Behind the Scenes",2023-07-30 11:48:33
136,CHAPLIN LICENSE,A Boring Drama of a Dog And a Forensic Psychologist who must Outrace a Explorer in Ancient India,2006,1,7,2.99,146,26.99,NC-17,Behind the Scenes,2023-07-30 11:48:33
137,CHARADE DUFFEL,A Action-Packed Display of a Man And a Waitress who must Build a Dog in A MySQL Convention,2006,1,3,2.99,66,21.99,PG,"Trailers,Deleted Scenes,Behind the Scenes",2023-07-30 11:48:33
138,CHARIOTS CONSPIRACY,A Unbelieveable Epistle of a Robot And a Husband who must Chase a Robot in The First Manned Space Station,2006,1,5,2.99,71,29.99,R,"Deleted Scenes,Behind the Scenes",2023-07-30 11:48:33
139,CHASING FIGHT,A Astounding Saga of a Technical Writer And a Butler who must Battle a Butler in A Shark Tank,2006,1,7,4.99,114,21.99,PG,"Trailers,Commentaries",2023-07-30 11:48:33
140,CHEAPER CLYDE,A Emotional Character Study of a Pioneer And a Girl who must Discover a Dog in Ancient Japan,2006,1,6,0.99,87,23.99,G,"Trailers,Commentaries,Behind the Scenes",2023-07-30 11:48:33
141,CHICAGO NORTH,A Fateful Yarn of a Mad Cow And a Waitress who must Battle a Student in California,2006,1,6,4.99,185,11.99,PG-13,"Deleted Scenes,Behind the Scenes",2023-07-30 11:48:33
142,CHICKEN HELLFIGHTERS,A Emotional Drama of a Dog And a Explorer who must Outrace a Technical Writer in Australia,2006,1,3,0.99,122,24.99,PG,"Trailers,Commentaries,Deleted Scenes,Behind the Scenes",2023-07-30 11:48:33
